{
  "$schema": "https://nervosys.ai/schemas/agents-discovery-v1.json",
  "schema_version": "1.0",
  "project": {
    "id": "ironvault",
    "name": "IronVault",
    "version": "8.0.1",
    "description": "Encrypted AI/ML model management system with versioning, 23+ format conversion, compliance validation (FIPS 140-3, CMMC 2.0, MITRE ATT&CK), RAG with MCP tools, federation, blockchain audit, model download (HuggingFace/Ollama/URL), HMAC signing & verification, pickle safety scanning, tensor-level diffing, engine interop (Ollama/LM Studio), license scanning, model tags & search, vault export/import, garbage collection, TUI dashboard, webhooks, role-based ACL, KMS integration, model validation, retention policies, cross-model lineage DAG, plugin system, config profiles, quantization pipeline, evaluation harness, backup scheduling, and multi-vault management.",
    "homepage": "https://github.com/nervosys/IronVault",
    "documentation": "https://github.com/nervosys/IronVault/tree/master/docs",
    "license": "AGPL-3.0-or-later",
    "languages": ["Rust"],
    "binary": "iv",
    "package_registry": "crates.io",
    "package_name": "ironvault"
  },

  "discovery": {
    "ontology": ".well-known/ontology.jsonld",
    "ontology_version": "2.0.0",
    "mcp_manifest": ".well-known/mcp-manifest.json",
    "ai_plugin": ".well-known/ai-plugin.json",
    "openapi": ".well-known/openapi.yaml",
    "readme": "README.md",
    "changelog": "CHANGELOG.md",
    "architecture": "docs/ARCHITECTURE_V2.md",
    "architecture_legacy": "docs/ARCHITECTURE.md"
  },

  "agent_interfaces": [
    {
      "type": "cli",
      "binary": "iv",
      "description": "Command-line interface with 42+ subcommands for vault, model, cloud, database, quantization, evaluation, backup, multi-vault, and utility operations. Use `iv introspect` for machine-readable CLI schema discovery.",
      "install": "cargo install ironvault",
      "help": "iv --help",
      "introspect": "iv introspect --format json",
      "exit_codes": {
        "0": "Success",
        "1": "General error",
        "2": "Authentication failed",
        "3": "Not found",
        "4": "Permission denied",
        "5": "Integrity check failed",
        "6": "Invalid input, including a mistyped subcommand or flag",
        "7": "Configuration error",
        "8": "Compliance violation"
      },
      "environment_variables": [
        {"name": "IRONVAULT_CONFIG", "description": "Config directory override"},
        {"name": "IRONVAULT_HOME", "description": "Relocates all config/data/cache directories under one root"},
        {"name": "IRONVAULT_VAULT", "description": "Default vault name"},
        {"name": "IRONVAULT_PASSPHRASE", "description": "Vault passphrase for automation: literal value or KMS URI (env://, file://, aws-sm://, azure-kv://, vault://)"},
        {"name": "AWS_ACCESS_KEY_ID", "description": "AWS S3 access key"},
        {"name": "AWS_SECRET_ACCESS_KEY", "description": "AWS S3 secret key"},
        {"name": "AWS_REGION", "description": "AWS region"},
        {"name": "AZURE_STORAGE_ACCOUNT", "description": "Azure storage account name"},
        {"name": "AZURE_STORAGE_SAS_TOKEN", "description": "Azure SAS token. Shared keys (AZURE_STORAGE_KEY) are not supported: the Azure SDK for Rust v1 has no shared-key credential"},
        {"name": "AZURE_TENANT_ID", "description": "Azure Entra ID tenant, as an alternative to a SAS token"},
        {"name": "AZURE_CLIENT_ID", "description": "Azure Entra ID client"},
        {"name": "AZURE_CLIENT_SECRET", "description": "Azure Entra ID client secret"},
        {"name": "OTEL_EXPORTER_OTLP_ENDPOINT", "description": "OTLP collector endpoint (requires the otel feature). Setting it does not enable telemetry"},
        {"name": "OTEL_EXPORTER_OTLP_HEADERS", "description": "OTLP headers, e.g. Authorization=Bearer <token>"},
        {"name": "DO_NOT_TRACK", "description": "Set to 1 to disable telemetry"}
      ]
    },
    {
      "type": "mcp",
      "description": "Model Context Protocol tooling, provided as a library surface rather than a running server: this crate ships no MCP transport. MCPServer and MCPTool (ironvault::rag) let a host process expose vault capabilities as MCP tools, and mcp-manifest.json is the 86-tool surface to register against. Extensible via MCPServer::register_tool.",
      "protocol_version": "2024-11-05",
      "manifest": ".well-known/mcp-manifest.json",
      "builtin_tools": ["search_documents", "add_document", "chunk_text", "execute_rule"],
      "declared_tools": {"count": 86, "manifest": ".well-known/mcp-manifest.json", "note": "Definitions, not shipped implementations -- register them in your host process."},
      "extensible": true
    },
    {
      "type": "rest_api",
      "description": "REST API powered by Axum with JWT authentication. Requires `api` cargo feature.",
      "feature_flag": "api",
      "default_port": 8080,
      "auth": "JWT (Bearer token)",
      "start_command": "iv serve --port 8080"
    },
    {
      "type": "graphql",
      "description": "GraphQL API powered by async-graphql. Requires `graphql` cargo feature.",
      "feature_flag": "graphql",
      "endpoint": "/graphql",
      "playground": "/graphql/playground"
    },
    {
      "type": "rust_library",
      "description": "Rust crate with public API for embedding in Rust applications.",
      "crate": "ironvault",
      "docs_rs": "https://docs.rs/ironvault",
      "key_types": ["Vault", "ModelVersion", "ModelMetadata", "ModelFormat", "ModelCard", "DocumentStore", "KnowledgeBase", "RuleEngine", "MCPServer", "ConversionPipeline"]
    },
    {
      "type": "python_bindings",
      "description": "Python bindings via PyO3. Requires `python` cargo feature.",
      "feature_flag": "python",
      "install": "pip install ironvault"
    }
  ],

  "capabilities": {
    "model_management": {
      "description": "Store, retrieve, version, and delete AI models with full encryption",
      "commands": ["iv init", "iv store", "iv get", "iv list", "iv versions", "iv lineage", "iv delete", "iv stats"],
      "formats_supported": 23,
      "versioning": "Sequential with parent lineage and branching"
    },
    "encryption": {
      "description": "Military-grade encryption for all stored models",
      "algorithm": "AES-256-GCM",
      "key_derivation": "Argon2id (64MB, 3 iterations)",
      "compliance": ["FIPS 140-3", "CMMC 2.0 Level 2"]
    },
    "format_conversion": {
      "description": "Convert models between 23+ formats with optional quantization",
      "commands": ["iv convert", "iv list-conversions"],
      "paths": [
        "PyTorch → Safetensors/ONNX/TorchScript/CoreML/MLX",
        "Safetensors → GGUF",
        "ONNX → TensorRT/OpenVINO/TFLite",
        "TensorFlow → TFLite"
      ],
      "quantization": ["q4_0", "q4_k_m", "q5_k_m", "q8_0"]
    },
    "compliance": {
      "description": "Automated compliance validation against industry standards",
      "commands": ["iv compliance"],
      "standards": ["FIPS 140-3", "CMMC 2.0 Level 2", "MITRE ATT&CK"]
    },
    "cloud_storage": {
      "description": "Push/pull models to cloud providers. Uploads are sealed client-side with AES-256-GCM (Argon2id key from the vault passphrase, fresh salt per object), so the bucket holds ciphertext. Objects pushed before 4.3.0 are plaintext and are accepted with a warning.",
      "commands": ["iv cloud push", "iv cloud pull", "iv cloud list", "iv cloud config"],
      "providers": ["AWS S3", "Azure Blob Storage"]
    },
    "rag": {
      "description": "Retrieval Augmented Generation system for AI-powered document search",
      "commands": ["iv database init", "iv database store", "iv database search", "iv database list"],
      "components": ["DocumentStore", "KnowledgeBase", "RuleEngine", "RetrievalCache"],
      "backends": ["InMemory", "SQLite", "Sled", "Qdrant", "LanceDB"]
    },
    "model_cards": {
      "description": "Structured model documentation following Google/HuggingFace standards",
      "commands": ["iv card"],
      "endpoints": [
        "GET /api/v1/models/{name}/card",
        "POST /api/v1/models/{name}/card",
        "POST /api/v1/models/{name}/card/generate",
        "POST /api/v1/models/{name}/card/validate"
      ],
      "export_formats": ["JSON", "YAML", "Markdown"]
    },
    "utilities": {
      "description": "Archive, analyze, deduplicate, and export models",
      "commands": ["iv archive", "iv extract", "iv analyze", "iv deduplicate", "iv export", "iv cache"],
      "tools": ["ModelArchive", "CompressionAnalyzer", "ModelAnalyzer", "ModelDeduplicator", "ModelExporter", "QuantizationInfo", "PruningInfo"]
    },
    "federation": {
      "description": "Sync vaults across peers with vector clocks and conflict resolution. Opt-in via federation.enabled; transfers are sealed client-side with AES-256-GCM by default. Peers authenticate with a shared X-API-Key, not the API's JWT.",
      "commands": [
        "iv federation status",
        "iv federation manifest",
        "iv federation plan",
        "iv federation sync"
      ],
      "endpoints": [
        "GET /api/v1/federation/manifest",
        "GET /api/v1/federation/models/{name}/versions/{checkpoint_id}",
        "PUT /api/v1/federation/models/{name}/versions/{checkpoint_id}"
      ],
      "feature_flag": "default",
      "enabled_by_default": false
    },
    "blockchain_audit": {
      "description": "Append-only blockchain audit trail with Merkle tree proofs. Opt-in via security.blockchain_audit; mirrors every audit-log entry into a hash-linked chain. Read-only from the CLI — entries are recorded by the audit logger, never by a command.",
      "commands": [
        "iv chain status",
        "iv chain verify",
        "iv chain proof",
        "iv chain verify-proof",
        "iv chain search"
      ],
      "feature_flag": "default",
      "enabled_by_default": false
    },
    "agent_discovery": {